recipe_title,recipe_source,recipe_step
,,
깻잎김치수제비,"['밀가루', '깻잎', '물', '김치']","['#1 #밀가루요리 #쫄깃한반죽 #수제비레시피깻잎향 은은한, 깻잎김치수제비', '#2 [필요한재료]밀가루1컵,깻잎10장,물200mL,김치1컵,물600mL,바지락100g,대파1/3뿌리,고춧가루1T', '#3 물과 깻잎을 믹서에 넣고곱게 갈아 준비 해 주세요.', '#4 고운 체나 면보를 사용해서즙부분만 깔끔하게 걸러주세요.', '#5 밀가루가 뭉쳐 질 만큼만조금씩 즙을 넣어가면서 5분정도 치대어주세요.', '#6 손에 더이상 반죽이 붙지 않게탄력이 주어지면 랩을 씌워 냉장고에 15분간 숙성할게요.', '#7 대파는 고명용으로 슬라이스 해 주세요.', '#8 끓는 물에 바지락을 넣고한소끔 우르르 끓어오르면 김치를 넣어주세요!', '#9 김칫국물은 감칠맛을 더해준다는 사실!+Tip 잘 숙성 된 김칫국물은,천연 조미료써의 역할을 제대로 해 준답니다!', '#10 숙성이 잘 마쳐진 쫄깃한 반죽을끓는 김치육수에 얇고 균일하게 떠서 넣어주세요.', '#11 한소끔 우르르 끓어오르면,기호에따라 고춧가루와 소금으로부족한 간을 맞춰주세요, 이렇게 완성입니다!', '#12 칼칼함을 품은 완소 수제비 레시피 :)', '#13 국물한번, 쫄깃한 수제비한번!속까지 아주 개운한 레시피랍니다.', '#14 쫄깃한 밀가루 음식이 땡기는 날엔?맛깔스러운 수제비로 넉넉함을 채워보세요!']"
날개달린교자,"['왕교자', '밀가루', '물']","['#1 ', '#2 안녕하세요 여러분! 꽃바람 하쿠예요~!', '#3 오늘은 술안주로 너무 적합하디 적합한날개달린교자를 만들어 보겠어요~!', '#4 너무 빨리 끝나니 눈 크게뜨고 보세요!그럼 저와 함께 팔로우 미~!', '#5 재료-왕교자 6개/밀가루 1T/물 1T', '#6 밀가루와 물을 덩어리 지지 않게 잘 풀어주세요!', '#7 오일을 두른 팬에 교자를 노릇노릇 구워주세요!', '#8 밑면이 다 익었다면, 밀가루물을 붓고 뚜껑을 덮어주세요!', '#9 수분이 다날라가면 팬을 흔들어 분리시킨 후,접시를 덮어 올려주세요~!', '#10 안주킹 날개달린교자 완성!', '#11 바삭바삭한 교자를 한입 먹으면!', '#12 저절로 맥주 부르는 맛! 여러분도 함께 도전해봐요~!']"
김치감자전,"['감자', '김치', '호박', '가지', '부추', '버섯', '소금', '식용유', '청고추', '홍고추']","['#1 앨샘이에요~ 오늘은 여름 제철 채소를 100%활용한 메뉴예요.밀가루 없이 갈아낸 감자에 여름 채소인 호박, 부추 그리고 김치를 송송 썰어 넣고 노릇하게 구워낸 부침개랍니다.시원한 막걸리 한잔 생각나네요?!ㅎㅎ', '#2 4인분/ 30분필수 재료감자 4~5개, 김치 1줌, 여름 채소(호박, 가지, 부추 등) 1줌, 버섯 1줌, 소금 ¼큰술, 식용유 적당량선택 재료청고추 1개, 홍고추 1개', '#3 1. 껍질을 깐 감자는 강판 또는 믹서기를 이용해 곱게 갈아요.', '#4 2. 간 감자에 소금(¼큰술)을 넣고 섞어요.', '#5 3. 김치와 준비한 채소, 버섯은 채 썰어요.', '#6 4. 잠시 두어 맑은 물이 떠오르면 가볍게 따라낸 뒤 준비한 김치와 채소를 넣고 섞어요.Tip - 국물을 따라 버리는 것이 어렵다면 밀가루를 살짝 섞어 농도를 맞춰 반죽해도 돼요.', '#7 5. 중간 불로 달군 팬에 식용유를 두른 뒤 반죽을 먹기 좋은 크기로 고루 펼쳐 올려 앞뒤로 노릇하게 구워요.Tip - 고추는 반죽과 섞어도 되지만 반죽을 팬에 올린 뒤 예쁘게 올려서 구워도 좋아요.', '#8 6. 장마철 시원한 막걸리, 맥주 한 잔 곁들이기 좋은 메뉴에요!밀가루가 전혀 들어가지 않아 더욱 담백해요. ']"
버섯달걀전,"['맛타리버섯', '채썬깐도라지', '밀가루', '소금', '달걀']","['#1 ', '#2 고소한 기름 냄새 풍기면 집에서 간단하게 만드는 달걀전을 준비했어요!쫄깃한 버섯을 가닥가닥 찢어 달걀물에 섞기만 하면 반죽은 끝! 간단한 레시피는 덤!ㅋ', '#3 재료(4인분/15분)필수 재료맛타리버섯(2줌), 채 썬 깐도라지(1줌), 밀가루(3큰술), 소금(⅛큰술), 달걀(2개)', '#4 맛타리버섯은 밑동을 제거한 뒤 잘게잘게 찢고, 아삭아삭 씹는 맛이 있는 깐 도라지는 가늘게 채 썰어요.도라지를 생략하고 양파를 사용하거나 버섯(1줌)을 더 넣어 만들어도 돼요^^', '#5 버섯과 도라지를 볼에 담고 밀가루(3큰술)을 넣어 버무려요.', '#6 밀가루가 고루 버무려지면 소금(⅛큰술), 달걀(2개)를 넣고 한 번 더 조물조물 버무리세요^^', '#7 식용유를 두른 팬을 중간 불로 달군 뒤 반죽을 먹기 좋은 크기로 얹어 노릇한 색이 나도록 구워요.', '#8 간장과 식초를 섞은 초간장을 곁들여 먹어도 맛있답니다 ㅋ']"
달걀 튀김,"['계란', '식초', '소금', '밀가루', '빵가루', '파슬리가루']","['#1 냄비에 물과 소금/식초를 약간 넣고 달걀을 삶아준다.', '#2 물이 끓으면 6분간 끓여준다.', '#3 찬물에 식혀 껍질을 까준다.', '#4 밀가루-달걀물-빵가루+파슬리가루 옷을 입혀 기름에 튀겨준다.']"
규카츠,"['소고기스테이크용', '밀가루', '빵가루', '소금', '후추', '녹말물', '고추냉이', '식용유']","['#1 ', '#2 안녕하세요 여러분! 꽃바람 하쿠예요~!', '#3 오늘은 밖에서 먹으면 조~금 비싼!', '#4 그렇다고 일본에선 못먹으니, 일본 느낌 물씬 나게 홈메이드 규카츠!그럼 시작해볼게요~!', '#5 재료-소고기 스테이크용 1팩/밀가루 2T/빵가루 4T/소금 2t/후추 2t녹말물 4T/고추냉이 1t/식용유 2컵', '#6 먼저 소고기에 소금과 후추로 밑간 한 후, 밀가루를 뭍혀 주세요!', '#7 밀가루-녹말물-빵가루 순으로 뭍혀 주세요!', '#8 기름이 달궈진 팬에 노릇노릇 구워주세요!', '#9 일본에 있는 그맛! 규카츠!', '#10 앞뒤 노릇하게 고추냉이와 함께 먹으면,', '#11 세상 부러운 맛! 여러분도 느껴보세요!']"
스카치에그,"['계란', '소시지', '소금', '후추', '밀가루', '빵가루']","['#1 안녕하세요! 이맥남입니다 :)오늘은 영국식 브런치요리인 스카치에그를 가지고 왔습니다!만들기도 어렵지 않고 맛도 굉장히 좋아요! 한번 따라해보세요 :)', '#2 재료 : 계란 3개, 소시지 400g 기준, 소금, 후추, 계란, 밀가루, 빵가루저는 소시지는 시중에 파는 로스구이용 소시지를 사용했어요! 별로 단가가 비싸지 않은 아이들로요!수제소시지를 사용하시면 제일 좋아요!', '#3 달걀은 찬물에 넣어서 끓인 다음 물이 끓고 나서 반숙으로 익히실 분들은 4분 완전히 익히실 분들은 6-8분정도 익혀주세요! 그러고 나서 얼음물이나 식초를 풀은 물에 식혀서 껍질을 까주세요!', '#4 소시지를 믹서기에 잘 갈아주세요! 그런 다음 소금, 후추로 간을 맞춰서 잘 섞어주세요.', '#5 그리고 껍질을 잘 깐 계란에 소시지 갈은 것을 잘 만두 빚듯이 감싸주세요.', '#6 그런 다음 밀가루 – 계란 – 빵가루를 골고루 빠짐없이 묻혀주세요! 저는 크기가 좀 크게 되어버렸네요.', '#7 그런 다음 중간불 정도의 기름에서 먹음직스럽게 5분정도 튀겨주시면 됩니다! ', '#8 소시지때문에 짭짭하면서도 계란덕분에 굉장히 담백하네요!내일 아침은 영국식 브런치 스카치에그 어떠세요!이맥남이였습니다 :)']"
치즈감자전,"['감자', '밀가루', '치즈', '소금']","['#1 감자는 껍질을 벗겨 채를 썰고 밀가루와 잘 섞어줘', '#2 기름을 두른 팬에 감자를 적당히 올리고 치즈를 올려!', '#3 치즈 위에 다시 감자를 포개 올리고 앞뒤로 튀기면!', '#4 감자튀김보다 맛있는 5분 치즈 감자전 완성!']"
