recipe_title,recipe_source,recipe_step
,,
고등어 무 조림,"['고등어', '무', '양파', '대파', '청양고추', '홍고추', '설탕', '마늘', '된장', '참기름', '고춧가루', '간장']","['#1 무 1/3개를 먹기 좋은 크기로 썰어 주세요.', '#2 냄비에 넓게 깔아주세요.', '#3 손질한 고등어를 올려 주세요.', '#4 썰어 놓은 양파 반개도 올려 주시고요.파도 한줌 넣어 주세요.', '#5 물은 네컵정도 넉넉히 넣어 주세요.', '#6 양념 재료를 넣어 주세요.', '#7 청, 홍 고추를 고명으로 올려  주세요.']"
고등어구이,"['고등어', '쌀뜨물', '카레가루', '후춧가루', '통마늘', '생강']","['#1 ', '#2 집에서 생선 굽기 부담스럽다는 해머거님들 많아요 ㅠ오늘은 비린내를 줄인 고등어 구이 팁을 알려드릴께요~^^', '#3 재료(4인분/30분)필수 재료고등어 구이용(1마리), 쌀뜨물(2컵), 카레가루(1/3큰술), 후춧가루(약간), 통마늘(6톨), 생강(1장)', '#4 고등어를 구이용으로 손질한 것을 구입하여 흐르는 물에 깨끗이 씻은 뒤 쌀뜨물에 20분 정도 담가 두었다가 건져요.쌀뜨물에 담가두면 비린내를 잡을 수 있어요!', '#5 키친타월로 지그시 눌러 물기를 제거한 뒤 살쪽에 카레가루와 후춧가루를 솔솔~ 뿌려 두구요~', '#6 마늘을 도톰하게 납짝 썰고 생강도 얇게 썬 것을 준비해 고등어에 올려요.식용유(1큰술)을 두른 팬에 껍질이 바닥에 가도록 올린 뒤 중약 불에서 13분 정도 굽다가 노릇한 색이 나면 뒤집어 7분 정도 더 구워요.', '#7 앞뒤로 노릇한 색이 나면 불을 끄구요~ 마늘도 건더기로 먹을 수 있으니 접시에 함께 담아요^^', '#8 카레가루로 비린내도 잡고, 간도 맞춰 밥반찬으로 딱이네요~~^^']"
아침 고등어,"['아침고등어', '고추장', '고춧가루', '간장', '설탕', '다진마늘', '물엿', '참기름', '쪽파']","['#1 반찬 걱정 그만~ 바로먹는 아침 고등어!', '#2 볼에 양념장 재료를 넣고 섞어 양념장을 만든다', '#3 달궈진 팬에 고등어를 살짝 굽고 양념장을 올려 뚜껑을 덮고 중불에서 타지 않을정도록 졸여 완성']"
고등어조림,"['고등어', '양파', '대파', '청홍고추', '무', '고구마줄기', '멸치육수', '쌀뜨물', '고추장', '고춧가루', '매실액', '설탕', '후추', '간장', '마늘', '생강가루']","['#1 제가 친구와 밥을 먹는동안 ㅎㅎㅎ 전 식구들에게 미리 저녁밥상을 차려줬죠!오늘 메뉴는 밥도둑인 고등어조림입니다!저희는 고등어조림에 고구마줄기를 넣고 해먹거든요!요게 요게 은근 맛있어요~우거지 넣는것도 맛있긴 한데 고구마줄기도 한몫한답니다.그럼 소개할께요.', '#2 [재료소개-3인분]고등어1마리,양파1/2개,대파한개,청홍고추 각각2개씩, 무1/6개,고구마줄기한줌,멸치육수2컵,쌀뜰물양념장-고추장한큰술,고춧가루3큰술,매실액3큰술,설탕1큰술,후추약간,간장3큰술,마늘한큰술,생강가루약간', '#3 [만드는법]고등어는 비린내를 제거하기 위해 쌀뜰물에 담그세요..', '#4 담근 고등어는 먹기좋은 크기로 칼집을 넣고 한입크기로 썰어주세요,양파는 크게 채썰고 대파는 큼직하게 청양고추는 어슷썰기로 고구마줄기는 한입크기로 썰어준비해주세요', '#5 양념장을 만들어주세요.', '#6 남은 쌀뜨물에 멸치를 담고 육수를 내어주세요.', '#7 육수가 준비되면 걸러놓고 무를 큼직하게 썰어놓고 웍에 무를 깔고', '#8 위에 고구마줄기를 놓고 양념장을 조금 올리세요.', '#9 그 위에 고등어를 올리고 양념장을 올리세요.', '#10 걸러놓은 육수를 잠길만큼부어 끓이세요.', '#11 얼추 반이상 끓으면 양파와 대파 고추를 넣고 은근한 불에서 졸이면 완성이에요.', '#12 매콤달콤한 고등어조림이 완성되었어요~']"
고등어조림덮밥,"['밥', '양파', '고등어', '레몬', '생강', '쯔유', '진간장', '물', '건땡초', '설탕', '후춧가루']","['#1 ', '#2 안녕! 여러분의 입맛저격수 마틸다에요~ 빵야~~ ♥', '#3 한끼 든든 짭조롬한 바다요리를 만들어볼까해요~재료를 준비해볼까요?', '#4 양념장재료와 건땡초, 편썬 생각은 한데 모아 잘 섞어주세요.', '#5 덮밥에 곁들일 양파는 얇게 슬라이스해 찬물에 담가 매운기를 빼주세용', '#6 먼저 손질한 고등어에서 가시를 최대한 발라 낸 후 비린내를 제거하기위해 얇게 슬라이스 한 레몬을 올려주세요~(레몬즙을 뿌려주셔도 좋아요!)', '#7 그 후 소금, 후추로 간을 하고 먹기 좋게 토막을 내어줍니다.', '#8 토막낸 고등어는 겉면에 밀가루옷을 얇게 입힌 후 ', '#9 기름을 넉넉히 둘러 달군 팬에 노릇히 구워줘요~ ', '#10 짠! 이렇게 노릇노릇하게 말이에용 ^ㅠ^', '#11 양쪽면이 노릇히 구워진 생선은 양념을 부어 타지않게 졸여주면 준비완료! ', '#12 따끈한 밥 위에 얇게 채썬 양파를 올린 뒤 ', '#13 맛있게 졸여진 고등어 조림을 올리면 완성!! ', '#14 따끈한 밥 위에 짭조름한 고등어조림이 푸짐하게 올라간 고등어조림덮밥이 완성되었습니당! ㄲㅑ~♥', '#15 고기고기에 잠시 물린 그대! 짭조롬하고 맛난 고등어조림덮밥은 어때요?여러분도 도전해보세요~ 빵야!!! ']"
삼치간장조림,"['삼치', '간장', '맛술', '올리고당', '생강즙', '메추리알', '꽈리고추', '마늘', '느타리버섯', '물', '소금']","['#1 간간한 삼치간장조림! 부드러운 메추리알과,꽈리고추,버섯까지 곁들여진 삼치조림 한번 보고가~', '#2 포실포실 삼치는 구이나 매운조림으로 많이 먹었지?오늘은 깔끔한 삼치간장조림을 들고왔어~ 룰루~', '#3 삼치는 먼저 먹기좋은 크기로 토막내주고,메추리알,꽈리고추,버섯,마늘!', '#4 삼치 등에 칼집! 소금간 해두는거 잊지말고~ ', '#5 양념장은 짱쉬워! 조림간장,맛술,물을 50ml씩 넣고생강즙1T 그리고 청하나 소주가 있으면 조리할때살짝 넣어줘~ 비린내 확 잡아주니까!', '#6 삼치는 물에 살짝 헹구고 등껍질이 바닥에 가도록냄비에 넣어줘~ 그리고 양념장과 마늘을 넣어주고끓여줄거야, 타지않게 중약불!', '#7 자글자글 끓여주다가 양념장이 반으로 줄면~!메추리알, 버섯 퐁당!', '#8 꽈리고추는 이쑤시개로 구멍뽕뽕!', '#9 국물이 거의 졸아들면 그때 꽈리고추 투하!오래익히면 색이 변하기 때문이야~! ', '#10 깔끔한 삼치 간장조림 완~!성!!삼치구이는 그만!', '#11 참치마요는 더 좋은 레시피로 돌아올게~~']"
꽁치간장조림,"['꽁치', '꽈리고추', '홍고추', '생강가루', '간장', '맛술', '설탕', '식용유']","['#1 ', '#2 안녕! 여러분의 입맛저격수 마틸다에요! 빵야!!!', '#3 캔꽁치를 밥도둑으로 만들어봐요! 자, 재료를 준비해주세요.꽁치캔1개 / 꽈리고추1줌 / 홍고추1개 생강가루4꼬집 / 간장4큰술 / 맛술 4큰술 / 설탕2큰술 / 식용유1큰술', '#4 양념재료는 한데 섞어 준비해요.', '#5 꽁치는 체에 받쳐 통조림액을 제거해 주세요![TIP] 비린내가 싫으신 분들은 한 번 흐르는 물에 헹궈 주세요!', '#6 고추는 어슷썰고 꽈리고추는 꼭지를 제거해주세요~', '#7 먼저 달군 팬에 준비한 양념을 부어주세요~', '#8 꽁치를 넣어 준 후 ~', '#9 손질한 고추를 넣어 졸이면 끝! 간단하죠?', '#10 [TIP] 꽁치가 부숴지지 않도록 잘 저어가며 졸여주시면 된답니다 : )', '#11 신흥 밥도둑 꽁치조림!  맛있게 보셨나요? 여러분도 도전해보세요! 빵야!']"
